{
  "schema_version": "dossier_v1",
  "run_id": "run_20260209_001",
  "created_at": "2026-02-09T00:00:00Z",
  "blueprint_hash": "sha256:deadbeef",
  "policy_bundle_id": "policy_bundle_v1",
  "data_snapshot_id": "data_snapshot_demo_001",
  "append_only": true,
  "artifacts": {
    "gate_results_json": "gate_results.json",
    "metrics_json": "metrics.json",
    "curve_csv": "curve.csv",
    "trades_csv": "trades.csv"
  },
  "hashes": { "gate_results.json": "0123456789abcdef0123456789abcdef0123456789abcdef0123456789abcdef" }
}

